{
  "$schema": "./adoption-report.schema.json",
  "schemaVersion": 1,
  "kind": "lds-ui-adoption-report",
  "contractVersion": "1",
  "id": "replace-with-adoption-id",
  "scope": {
    "mode": "full-surface",
    "paths": [
      "src/ui/**"
    ],
    "excluded": []
  },
  "surfaces": [
    {
      "id": "replace-with-surface-id",
      "paths": [
        "src/ui/**"
      ],
      "facets": {
        "tokensAndTheme": {
          "verdict": "reviewed",
          "detail": "Replace with the reviewed Tokens and theme runtime decision summary and ownership boundary.",
          "evidence": [
            {
              "kind": "decision",
              "ref": "replace-with-reproducible-evidence"
            }
          ],
          "decisions": [
            {
              "decisionId": "owner-package-css-order",
              "outcome": "Replace with the concrete owner package and CSS import order outcome.",
              "evidence": [
                {
                  "kind": "source",
                  "ref": "replace-with-owner-package-css-order-evidence"
                }
              ]
            },
            {
              "decisionId": "font-theme-scope",
              "outcome": "Replace with the concrete font and theme provider scope outcome.",
              "evidence": [
                {
                  "kind": "source",
                  "ref": "replace-with-font-theme-scope-evidence"
                }
              ]
            },
            {
              "decisionId": "color-scheme-behavior",
              "outcome": "Replace with the concrete light, dark, and auto behavior outcome.",
              "evidence": [
                {
                  "kind": "source",
                  "ref": "replace-with-color-scheme-behavior-evidence"
                }
              ]
            },
            {
              "decisionId": "token-mapping",
              "outcome": "Replace with the concrete semantic or component token mapping outcome.",
              "evidence": [
                {
                  "kind": "source",
                  "ref": "replace-with-token-mapping-evidence"
                }
              ]
            },
            {
              "decisionId": "raw-visual-literals",
              "outcome": "Replace with the concrete raw visual literal disposition outcome.",
              "evidence": [
                {
                  "kind": "source",
                  "ref": "replace-with-raw-visual-literals-evidence"
                }
              ]
            }
          ]
        },
        "layoutAndVisualFoundations": {
          "verdict": "reviewed",
          "detail": "Replace with the reviewed Layout and visual foundations decision summary and ownership boundary.",
          "evidence": [
            {
              "kind": "decision",
              "ref": "replace-with-reproducible-evidence"
            }
          ],
          "decisions": [
            {
              "decisionId": "semantic-reading-order",
              "outcome": "Replace with the concrete semantic structure and reading order outcome.",
              "evidence": [
                {
                  "kind": "source",
                  "ref": "replace-with-semantic-reading-order-evidence"
                }
              ]
            },
            {
              "decisionId": "grid-container-mapping",
              "outcome": "Replace with the concrete grid and container mapping outcome.",
              "evidence": [
                {
                  "kind": "source",
                  "ref": "replace-with-grid-container-mapping-evidence"
                }
              ]
            },
            {
              "decisionId": "responsive-overflow-ownership",
              "outcome": "Replace with the concrete responsive and overflow ownership outcome.",
              "evidence": [
                {
                  "kind": "source",
                  "ref": "replace-with-responsive-overflow-ownership-evidence"
                }
              ]
            },
            {
              "decisionId": "typography-data-formatting",
              "outcome": "Replace with the concrete typography hierarchy and data formatting outcome.",
              "evidence": [
                {
                  "kind": "source",
                  "ref": "replace-with-typography-data-formatting-evidence"
                }
              ]
            },
            {
              "decisionId": "visual-foundation-mapping",
              "outcome": "Replace with the concrete spacing, radius, elevation, gradient, and aspect-ratio mapping outcome.",
              "evidence": [
                {
                  "kind": "source",
                  "ref": "replace-with-visual-foundation-mapping-evidence"
                }
              ]
            }
          ]
        },
        "statePatternsAndMotion": {
          "verdict": "reviewed",
          "detail": "Replace with the reviewed State, cross-component patterns, and motion decision summary and ownership boundary.",
          "evidence": [
            {
              "kind": "decision",
              "ref": "replace-with-reproducible-evidence"
            }
          ],
          "decisions": [
            {
              "decisionId": "async-state-model",
              "outcome": "Replace with the concrete ready, loading, empty, error, stale, offline, disabled, and recovery states outcome.",
              "evidence": [
                {
                  "kind": "source",
                  "ref": "replace-with-async-state-model-evidence"
                }
              ]
            },
            {
              "decisionId": "loading-pattern-scope",
              "outcome": "Replace with the concrete Loading pattern element and scope outcome.",
              "evidence": [
                {
                  "kind": "source",
                  "ref": "replace-with-loading-pattern-scope-evidence"
                }
              ]
            },
            {
              "decisionId": "retained-content-refresh",
              "outcome": "Replace with the concrete retained-content and refreshing behavior outcome.",
              "evidence": [
                {
                  "kind": "source",
                  "ref": "replace-with-retained-content-refresh-evidence"
                }
              ]
            },
            {
              "decisionId": "motion-reduced-motion",
              "outcome": "Replace with the concrete motion purpose, duration, and reduced-motion behavior outcome.",
              "evidence": [
                {
                  "kind": "source",
                  "ref": "replace-with-motion-reduced-motion-evidence"
                }
              ]
            }
          ]
        },
        "assetsIconographyAndBrand": {
          "verdict": "reviewed",
          "detail": "Replace with the reviewed Assets, iconography, and brand decision summary and ownership boundary.",
          "evidence": [
            {
              "kind": "decision",
              "ref": "replace-with-reproducible-evidence"
            }
          ],
          "decisions": [
            {
              "decisionId": "registry-search",
              "outcome": "Replace with the concrete existing icon and asset registry search outcome.",
              "evidence": [
                {
                  "kind": "source",
                  "ref": "replace-with-registry-search-evidence"
                }
              ]
            },
            {
              "decisionId": "asset-owner-public-path",
              "outcome": "Replace with the concrete asset owner package and public path outcome.",
              "evidence": [
                {
                  "kind": "source",
                  "ref": "replace-with-asset-owner-public-path-evidence"
                }
              ]
            },
            {
              "decisionId": "provenance-license",
              "outcome": "Replace with the concrete provenance and license outcome.",
              "evidence": [
                {
                  "kind": "source",
                  "ref": "replace-with-provenance-license-evidence"
                }
              ]
            },
            {
              "decisionId": "asset-semantics-alt",
              "outcome": "Replace with the concrete decorative or informative semantics and alternative text outcome.",
              "evidence": [
                {
                  "kind": "source",
                  "ref": "replace-with-asset-semantics-alt-evidence"
                }
              ]
            },
            {
              "decisionId": "theme-suitability",
              "outcome": "Replace with the concrete light and dark suitability outcome.",
              "evidence": [
                {
                  "kind": "source",
                  "ref": "replace-with-theme-suitability-evidence"
                }
              ]
            }
          ]
        },
        "contentAndInternationalization": {
          "verdict": "reviewed",
          "detail": "Replace with the reviewed Content and internationalization decision summary and ownership boundary.",
          "evidence": [
            {
              "kind": "decision",
              "ref": "replace-with-reproducible-evidence"
            }
          ],
          "decisions": [
            {
              "decisionId": "copy-product-truth",
              "outcome": "Replace with the concrete user-visible copy set and product truth outcome.",
              "evidence": [
                {
                  "kind": "source",
                  "ref": "replace-with-copy-product-truth-evidence"
                }
              ]
            },
            {
              "decisionId": "writing-voice",
              "outcome": "Replace with the concrete Writing and Voice disposition outcome.",
              "evidence": [
                {